"question","answering"
"What is the primary legislation governing mining in India?","The primary legislation governing mining in India is the Mines and Minerals (Development and Regulation) Act, 1957."
"When was the Mines and Minerals (Development and Regulation) Act, 1957 enacted?","The Mines and Minerals (Development and Regulation) Act, 1957 was enacted on 28th December 1957."
"What are the objectives of the Mines and Minerals (Development and Regulation) Act, 1957?","The objectives of the Mines and Minerals (Development and Regulation) Act, 1957 include the regulation of mineral exploration, grant of mineral concessions, and the development and conservation of minerals in India."
"Which government department is responsible for implementing mining laws in India?","The Ministry of Mines, Government of India, is responsible for implementing mining laws in India."
"What is the role of the Indian Bureau of Mines (IBM) in regulating mining activities?","The Indian Bureau of Mines (IBM) plays a key role in regulating mining activities by conducting surveys, collecting mineral data, and enforcing mineral conservation and environmental regulations."
"Define mineral as per the Mines and Minerals (Development and Regulation) Act, 1957.","As per the Act, mineral includes all substances obtained or produced by mining, such as minerals, ores, and rocks."
"What are the different types of minerals categorized under the Act?","The Act categorizes minerals into two types: major minerals and minor minerals, each subject to different regulations."
"How is the ownership of minerals determined in India?","The ownership of minerals in India is vested with the government, and individuals or entities can obtain mineral concessions through licenses and leases."
"What is the process for obtaining a mining lease in India?","To obtain a mining lease, one must apply to the State government or the Central government, depending on the location of the mineral, and follow the prescribed procedure, including public auctions in some cases."
"What is the duration of a mining lease under the Act?","The duration of a mining lease typically ranges from 20 to 50 years, depending on the mineral and the state government's policies."
"Explain the concept of reconnaissance permit.","A reconnaissance permit allows preliminary exploration of minerals in a specified area to assess their potential. It does not confer mining rights."
"What is the purpose of a prospecting license?","A prospecting license is granted to conduct detailed exploration of minerals within a specific area to determine their quantity and quality."
"Can a prospecting license be transferred to another party?","Yes, in certain cases, a prospecting license can be transferred to another party with the government's approval."
"What are the environmental clearances required for mining operations in India?","Mining operations in India require environmental clearances from the Ministry of Environment, Forest and Climate Change (MoEFCC) to ensure compliance with environmental regulations."
"What is the National Mineral Policy, and when was it last revised?","The National Mineral Policy is a comprehensive policy framework for the mineral sector in India. It was last revised in 2019."
"How are royalties calculated for mineral extraction in India?","Royalties for mineral extraction are calculated based on the mineral type and quantity and are typically a percentage of the sale value."
"What is the role of the District Mineral Foundation (DMF) in mining areas?","The District Mineral Foundation (DMF) is responsible for managing funds generated from mining activities for the socio-economic development of affected communities in mining areas."
"How is the compensation for land acquisition for mining determined?","Compensation for land acquisition for mining is determined based on the prevailing market rates, rehabilitation and resettlement packages, and government regulations."
"Explain the provisions related to the auction of mining leases.","Mining leases for major minerals are often auctioned through a transparent bidding process to select the highest bidder."
"What is the procedure for the renewal of a mining lease?","The renewal of a mining lease involves applying to the respective government authority and complying with conditions and regulations. Renewals are typically for a specified term."
"Discuss the role of State governments in regulating mining activities.","State governments have the authority to grant mineral concessions, collect royalties, and enforce mining regulations within their jurisdictions."
"What are the penalties for illegal mining under the Act?","Penalties for illegal mining can include fines, imprisonment, and the cancellation of mining licenses or leases."
"Explain the concept of mining plan in the context of the Act.","A mining plan is a detailed document outlining the proposed mining operations, including environmental safeguards, submitted as part of the mining lease application."
"How is the forest clearance obtained for mining in forested areas?","Forest clearances for mining in forested areas are obtained from the Ministry of Environment, Forest and Climate Change (MoEFCC) and may require compensatory afforestation."
"What is the significance of the Sustainable Development Framework (SDF) in mining?","The Sustainable Development Framework (SDF) is a tool to ensure that mining activities promote sustainable development, environmental protection, and social welfare."
"Discuss the provisions related to the rehabilitation and resettlement of affected people due to mining activities.","The Act contains provisions for the rehabilitation and resettlement of affected communities to mitigate the adverse impacts of mining."
"What are the restrictions on the export of minerals from India?","Export of minerals from India is subject to various restrictions and regulations, including obtaining necessary approvals."
"How are disputes related to mining leases resolved under the Act?","Disputes related to mining leases can be resolved through arbitration or legal proceedings as per the provisions of the Act."
"What are the safety and health regulations for miners in India?","Safety and health regulations for miners in India are enforced to ensure safe working conditions and include guidelines on ventilation, equipment, and safety measures."
"Explain the role of the Central Empowered Committee (CEC) in addressing environmental issues in mining.","The Central Empowered Committee (CEC) is responsible for assessing environmental concerns and violations in mining projects and providing recommendations to the courts."
"What is the significance of the Pradhan Mantri Khanij Kshetra Kalyan Yojana (PMKKKY)?","PMKKKY is a welfare scheme aimed at ensuring the socio-economic development of mining-affected areas by utilizing funds generated from mining activities."
"Discuss the provisions of the Atomic Minerals Concession Rules, 2016.","The Atomic Minerals Concession Rules, 2016, govern the exploration and exploitation of atomic minerals in India, subject to specific regulations."
"How does the Act address the rights of tribal communities in mining areas?","The Act includes provisions to safeguard the rights and interests of tribal communities in mining areas, including their right to share benefits from mining."
"What are the provisions for the auction of minor minerals?","Minor minerals are often auctioned through a transparent bidding process to select the highest bidder."
"Explain the concept of non-exclusive reconnaissance permit.","A non-exclusive reconnaissance permit allows multiple parties to conduct preliminary exploration in the same area, but it does not grant exclusive rights to any party."
"How is the compensation for land acquired for mining determined?","Compensation for land acquired for mining is determined based on market rates, rehabilitation and resettlement packages, and government regulations."
"What is the National Mineral Exploration Policy (NMEP)?","The National Mineral Exploration Policy (NMEP) aims to promote mineral exploration and increase the availability of mineral resources through various initiatives and reforms."
"How are mining leases granted in tribal areas?","Mining leases in tribal areas are subject to specific regulations and the consent of the tribal communities, as outlined in the Act."
"Discuss the role of the Ministry of Environment, Forest and Climate Change (MoEFCC) in mining approvals.","The MoEFCC is responsible for granting environmental clearances and forest clearances for mining projects, ensuring compliance with environmental regulations."
"What is the significance of the Mineral Conservation and Development Rules, 2017?","The Mineral Conservation and Development Rules, 2017, focus on conserving minerals, reducing wastage, and promoting sustainable mining practices."
